{
  "version": 1,
  "template": {
    "source": "canonical-figma-node",
    "fileKey": "MGMCrXQxxIvOkCAAw3bxCq",
    "nodeId": "77:501",
    "width": 840,
    "titleHeight": 120,
    "accent": "#9fc14f",
    "policyAccent": "#1e78f0"
  },
  "feature": "픽드랍 예약",
  "project": "Pet Care System Biz Web",
  "generatedFrom": "pickdrop-reservation-feature-spec.md",
  "cards": [
    {
      "id": "S-01",
      "frameName": "1",
      "situation": "픽드랍 예약",
      "screenName": "예약 목록 - 픽드랍 목록 모달",
      "screenPath": "유치원 예약 목록 > 픽드랍 목록",
      "caseName": "선택한 날짜의 픽업/드랍 대상자를 빠르게 확인한다.",
      "blocks": [
        {
          "number": "P",
          "kind": "policy",
          "title": "픽드랍 예약",
          "bullets": [
            "운영자는 예약 목록에서 날짜를 선택한 뒤 픽드랍 목록을 열어 해당 날짜에 픽업 또는 드랍이 필요한 회원을 확인한다.",
            "이 모달은 예약을 수정하는 화면이 아니라, 선택 날짜의 픽드랍 운영 대상을 조회하는 화면이다.",
            "픽드랍 목록은 예약 날짜별 entry의 pickup, dropoff 상태를 기준으로 산출한다.",
            "픽업과 드랍 필터를 모두 끄는 상태는 유지하지 않고 전체 필터 상태로 복구한다.",
            "대상자 정보는 회원 데이터가 있으면 회원 정보를 우선 표시하고, 없으면 예약에 저장된 정보를 사용한다."
          ]
        },
        {
          "number": "1",
          "kind": "item",
          "title": "[Button] 이전 날짜 버튼",
          "bullets": [
            "영역 : 날짜 컨트롤",
            "기준 날짜를 하루 전으로 이동하고 픽드랍 대상자 목록을 다시 계산한다.",
            "예외 : 날짜 변경에 실패하면 기존 날짜와 목록을 유지한다.",
            "상태 : 기본",
            "데이터 영향 : 예약 데이터 읽기"
          ]
        },
        {
          "number": "2",
          "kind": "item",
          "title": "[Input] 날짜 입력",
          "bullets": [
            "영역 : 날짜 컨트롤",
            "입력한 날짜를 기준으로 픽업/드랍 대상자를 조회한다.",
            "예외 : 유효하지 않은 날짜는 목록 갱신에 반영하지 않는다.",
            "상태 : 기본, 변경됨",
            "데이터 영향 : 예약 데이터 읽기"
          ]
        },
        {
          "number": "3",
          "kind": "item",
          "title": "[Button] 다음 날짜 버튼",
          "bullets": [
            "영역 : 날짜 컨트롤",
            "기준 날짜를 하루 뒤로 이동하고 픽드랍 대상자 목록을 다시 계산한다.",
            "예외 : 날짜 변경에 실패하면 기존 날짜와 목록을 유지한다.",
            "상태 : 기본",
            "데이터 영향 : 예약 데이터 읽기"
          ]
        },
        {
          "number": "4",
          "kind": "item",
          "title": "[Option] 픽업 필터",
          "bullets": [
            "영역 : 필터 영역",
            "픽업이 포함된 예약만 목록 조건에 포함하거나 제외한다.",
            "예외 : 픽업과 드랍이 모두 해제되면 두 필터를 다시 켠다.",
            "상태 : 체크됨, 해제됨",
            "데이터 영향 : 데이터 변경 없음"
          ]
        },
        {
          "number": "5",
          "kind": "item",
          "title": "[Option] 드랍 필터",
          "bullets": [
            "영역 : 필터 영역",
            "드랍이 포함된 예약만 목록 조건에 포함하거나 제외한다.",
            "예외 : 픽업과 드랍이 모두 해제되면 두 필터를 다시 켠다.",
            "상태 : 체크됨, 해제됨",
            "데이터 영향 : 데이터 변경 없음"
          ]
        },
        {
          "number": "6",
          "kind": "item",
          "title": "[Item] 대상자 카드",
          "bullets": [
            "영역 : 대상자 목록",
            "조건에 맞는 보호자명, 반려견명, 주소, 픽업/드랍 유형을 카드로 표시한다.",
            "예외 : 주소가 없으면 주소 미정 상태로 표시한다.",
            "상태 : 결과 있음",
            "데이터 영향 : 예약 및 회원 데이터 읽기"
          ]
        },
        {
          "number": "7",
          "kind": "item",
          "title": "[Option] 빈 상태 메시지",
          "bullets": [
            "영역 : 대상자 목록",
            "선택 날짜와 필터에 맞는 대상자가 없으면 빈 상태를 표시한다.",
            "예외 : 필터가 모두 꺼져 생긴 빈 상태는 허용하지 않는다.",
            "상태 : Empty",
            "데이터 영향 : 데이터 변경 없음"
          ]
        },
        {
          "number": "8",
          "kind": "item",
          "title": "[Button] 닫기 / 오버레이 / Esc",
          "bullets": [
            "영역 : 모달 액션",
            "모달을 닫고 예약 목록으로 돌아간다.",
            "예외 : 조회 전용 모달이므로 저장 손실 경고는 표시하지 않는다.",
            "상태 : Closed",
            "데이터 영향 : 데이터 변경 없음"
          ]
        }
      ]
    },
    {
      "id": "S-02",
      "frameName": "2",
      "situation": "픽드랍 예약",
      "screenName": "예약 등록 모달 - 유치원/데이케어 단계",
      "screenPath": "유치원 예약 목록 > 예약 등록 > 유치원 또는 데이케어",
      "caseName": "회원, 서비스, 날짜, 픽드랍 포함 여부, 요금과 결제 정보를 선택해 예약을 준비한다.",
      "blocks": [
        {
          "number": "P",
          "kind": "policy",
          "title": "픽드랍 예약",
          "bullets": [
            "운영자는 예약 등록 모달에서 회원을 먼저 선택한 뒤 클래스 또는 데이케어 서비스를 선택하고 예약 날짜를 지정한다.",
            "같은 단계에서 픽업/드랍 체크박스를 켜면 서비스 예약 날짜에 픽드랍을 함께 붙일 수 있다.",
            "픽업과 드랍을 모두 선택하면 왕복 기준, 하나만 선택하면 편도 기준으로 요금과 이용권 차감을 계산한다.",
            "서비스 단계의 초과 예약은 초과 등록 체크가 있어야 저장할 수 있다.",
            "픽드랍 요금은 선택된 픽드랍 종류와 픽드랍 적용 날짜 수를 기준으로 계산한다.",
            "이용권 결제는 실제 금액 입력 없이 이용권 사용 상태로 결제 요약을 구성한다."
          ]
        },
        {
          "number": "1",
          "kind": "item",
          "title": "[Input] 회원 검색 입력",
          "bullets": [
            "영역 : 회원 영역",
            "반려견 또는 보호자 검색어에 맞는 회원 결과를 표시하고, 선택 시 회원 정보와 이용권 정보를 불러온다.",
            "예외 : 검색 결과가 없으면 결과 목록을 비운다.",
            "상태 : 입력 중, 선택됨",
            "데이터 영향 : 회원 및 이용권 데이터 읽기"
          ]
        },
        {
          "number": "2",
          "kind": "item",
          "title": "[Option] 지우기 버튼",
          "bullets": [
            "영역 : 회원 영역",
            "선택 회원, 서비스, 날짜, 픽드랍 선택, 이용권 선택을 초기화한다.",
            "예외 : 픽드랍 단계에서는 회원 변경을 막기 위해 비활성화된다.",
            "상태 : 활성, 비활성",
            "데이터 영향 : 화면 상태 초기화"
          ]
        },
        {
          "number": "3",
          "kind": "item",
          "title": "[Option] 클래스 칩",
          "bullets": [
            "영역 : 서비스 선택 영역",
            "하나의 유치원 클래스를 선택하고 예약 가능 날짜, 이용권, 요금 계산을 갱신한다.",
            "예외 : 데이케어 클래스는 기존 날짜 충돌 검사에서 제외하고 시간 중복 검사를 따른다.",
            "상태 : 선택됨, 미선택",
            "데이터 영향 : 서비스 선택 상태 갱신"
          ]
        },
        {
          "number": "4",
          "kind": "item",
          "title": "[Input] 데이케어 시간 입력",
          "bullets": [
            "영역 : 서비스 선택 영역",
            "데이케어 예약의 시작/종료 시간을 입력한다.",
            "예외 : 시작/종료 누락, 종료가 시작보다 빠름, 동일 회원 시간 중복이면 등록을 차단하고 안내한다.",
            "상태 : 입력됨, 오류",
            "데이터 영향 : 예약 시간 및 데이케어 요금 계산"
          ]
        },
        {
          "number": "5",
          "kind": "item",
          "title": "[Option] 픽업 체크박스",
          "bullets": [
            "영역 : 픽드랍 선택 영역",
            "선택 날짜에 픽업 플래그를 적용하고 픽드랍 요금과 이용권 차감 계획을 다시 계산한다.",
            "예외 : 픽업만 선택하면 편도 기준으로 계산한다.",
            "상태 : 체크됨, 해제됨",
            "데이터 영향 : 예약 entry pickup 값 갱신 예정"
          ]
        },
        {
          "number": "6",
          "kind": "item",
          "title": "[Option] 드랍 체크박스",
          "bullets": [
            "영역 : 픽드랍 선택 영역",
            "선택 날짜에 드랍 플래그를 적용하고 픽드랍 요금과 이용권 차감 계획을 다시 계산한다.",
            "예외 : 드랍만 선택하면 편도 기준으로 계산한다.",
            "상태 : 체크됨, 해제됨",
            "데이터 영향 : 예약 entry dropoff 값 갱신 예정"
          ]
        },
        {
          "number": "7",
          "kind": "item",
          "title": "[Option] 미니 캘린더 날짜 셀",
          "bullets": [
            "영역 : 날짜/횟수 영역",
            "날짜를 선택하거나 해제하고 예약 횟수, 이용권 차감, 요금을 갱신한다.",
            "예외 : 충돌 날짜는 비활성화되어 선택할 수 없다.",
            "상태 : 기본, 선택됨, 오늘, 비활성",
            "데이터 영향 : 예약 날짜 후보 갱신"
          ]
        },
        {
          "number": "8",
          "kind": "item",
          "title": "[Option] 예약 횟수 표시",
          "bullets": [
            "영역 : 날짜/횟수 영역",
            "현재 선택 횟수와 사용 가능 횟수를 표시하고 초과 시 초과 횟수를 보여준다.",
            "예외 : 회원 이용권 한도가 없으면 선택 횟수 기준으로 표시한다.",
            "상태 : 정상, 초과",
            "데이터 영향 : 예약 가능 횟수 계산"
          ]
        },
        {
          "number": "9",
          "kind": "item",
          "title": "[Option] 초과 등록 체크",
          "bullets": [
            "영역 : 날짜/횟수 영역",
            "서비스 단계에서 가능 횟수 초과 예약을 허용한다.",
            "예외 : 초과 상태가 아니면 비활성화된다.",
            "상태 : 비활성, 활성, 체크됨",
            "데이터 영향 : 초과 등록 허용 상태 갱신"
          ]
        },
        {
          "number": "10",
          "kind": "item",
          "title": "[Option] 픽드랍 요금 세그먼트",
          "bullets": [
            "영역 : 요금/결제 영역",
            "픽업/드랍 선택과 날짜 수에 따라 편도 또는 왕복 요금 라인을 표시한다.",
            "예외 : 등록된 픽드랍 요금이 없으면 요금 없음 상태를 표시한다.",
            "상태 : 금액 있음, 없음",
            "데이터 영향 : 요금 데이터 읽기"
          ]
        },
        {
          "number": "11",
          "kind": "item",
          "title": "[Option] 이용권 탭",
          "bullets": [
            "영역 : 요금/결제 영역",
            "서비스 이용권과 픽드랍 이용권의 사용 전/후 잔여 횟수를 표시한다.",
            "예외 : 사용 가능한 이용권이 없으면 빈 상태 문구를 표시한다.",
            "상태 : 선택됨, 빈 상태, 초과",
            "데이터 영향 : 이용권 차감 예정 계산"
          ]
        },
        {
          "number": "12",
          "kind": "item",
          "title": "[Input] 현장 결제 탭",
          "bullets": [
            "영역 : 요금/결제 영역",
            "현금, 계좌이체, 카드 중 결제수단을 선택하고 결제 금액을 입력한다.",
            "예외 : 숫자 외 입력은 금액 형식에서 제거한다.",
            "상태 : 입력됨",
            "데이터 영향 : 결제 초안 갱신"
          ]
        }
      ]
    },
    {
      "id": "S-03",
      "frameName": "3",
      "situation": "픽드랍 예약",
      "screenName": "예약 등록 모달 - 픽드랍 단계",
      "screenPath": "예약 등록 모달 > 픽드랍까지 예약 / 픽드랍만 예약",
      "caseName": "선택 회원의 픽드랍 날짜, 픽업/드랍 종류, 픽드랍 이용권을 지정해 예약한다.",
      "blocks": [
        {
          "number": "P",
          "kind": "policy",
          "title": "픽드랍 예약",
          "bullets": [
            "픽드랍 단계는 서비스 예약에 이어 픽드랍을 함께 등록하거나, 서비스 날짜 없이 픽드랍만 등록하는 단계다.",
            "이 단계로 진입하면 회원 영역은 잠기고 진행 단계는 픽드랍이 활성화된다.",
            "픽업+드랍은 왕복 이용권 1회를 우선 사용한다.",
            "왕복 이용권이 부족하면 편도 이용권 2회를 대체 사용한다.",
            "픽업 또는 드랍 하나만 선택한 경우 편도 이용권 1회를 우선 사용하고, 없으면 왕복 이용권 1회를 대체 사용할 수 있다.",
            "서비스 날짜가 없는 픽드랍 전용 예약은 서비스명 없이 픽드랍 플래그와 픽드랍 이용권 사용만 포함한 날짜 entry로 저장된다."
          ]
        },
        {
          "number": "1",
          "kind": "item",
          "title": "[Input] 회원 검색 입력",
          "bullets": [
            "영역 : 잠긴 회원 영역",
            "선택된 회원을 표시하되 수정할 수 없게 잠근다.",
            "예외 : 회원을 변경하려면 이전 단계로 돌아가 초기화 후 다시 선택해야 한다.",
            "상태 : 비활성",
            "데이터 영향 : 회원 데이터 읽기"
          ]
        },
        {
          "number": "2",
          "kind": "item",
          "title": "[State] 진행 단계 표시",
          "bullets": [